### ISSUE TITLE
"ndisc_cache: neighbor table overflow!"

### ISSUE THREAD

**Issue by FFHener** [freifunk-berlin/bbb-configs#512]
After flashing a new router for #511 this warn-message randomly appeared and dissapered again 2 times. I'm unshure where the root of this Error is so here are a bunch of Infos hopefully being helpful. The timeline was: I installed the router in the afternoon, it suddenly stopped working during evening, but was still reachable via IPv6-link local. During the night it suddenly worked again (according to monitoring), but I found similar error-message during a timespan of 10 min in the morning.

Initial logread and routes during the evening:
```
~# logread
daemon.warn odhcpd[1519]: No default route present, overriding ra_lifetime!


~# ip r
10.31.137.48/28 dev switch0.42 proto kernel scope link src 10.31.137.49 
10.31.211.64/26 dev switch0.40 proto kernel scope link src 10.31.211.65 


~# ping 1.1.1.1
PING 1.1.1.1 (1.1.1.1): 56 data bytes
ping: sendto: Network unreachable


~# ip r s t all
10.31.137.48/28 dev switch0.42 proto kernel scope link src 10.31.137.49 
10.31.211.64/26 dev switch0.40 proto kernel scope link src 10.31.211.65 
local 10.31.137.49 dev switch0.42 table local proto kernel scope host src 10.31.137.49 
broadcast 10.31.137.63 dev switch0.42 table local proto kernel scope link src 10.31.137.49 
local 10.31.174.8 dev switch0.10 table local proto kernel scope host src 10.31.174.8 
local 10.31.174.9 dev switch0.11 table local proto kernel scope host src 10.31.174.9 
local 10.31.174.10 dev switch0.20 table local proto kernel scope host src 10.31.174.10 
local 10.31.211.65 dev switch0.40 table local proto kernel scope host src 10.31.211.65 
broadcast 10.31.211.127 dev switch0.40 table local proto kernel scope link src 10.31.211.65 
local 127.0.0.0/8 dev lo table local proto kernel scope host src 127.0.0.1 
local 127.0.0.1 dev lo table local proto kernel scope host src 127.0.0.1 
broadcast 127.255.255.255 dev lo table local proto kernel scope link src 127.0.0.1 
default from 2001:bf7::/32 via fe80::1411:58ff:fe2b:4cff dev switch0.10 proto babel metric 1024 onlink pref medium
2001:bf7:750:1200::/56 via fe80::1411:58ff:fe2b:4cff dev switch0.10 proto babel metric 1024 onlink pref medium
2001:bf7:750:2a00::/56 via fe80::1411:58ff:fe2b:4cff dev switch0.10 proto babel metric 1024 onlink pref medium
2001:bf7:750:2e00::/60 via fe80::1411:58ff:fe2b:4cff dev switch0.10 proto babel metric 1024 onlink pref medium
2001:bf7:750:3200::/56 via fe80::1411:58ff:fe2b:4cff dev switch0.10 proto babel metric 1024 onlink pref medium
2001:bf7:750:3300::/56 via fe80::1411:58ff:fe2b:4cff dev switch0.10 proto babel metric 1024 onlink pref medium
2001:bf7:750:3400::/56 via fe80::1411:58ff:fe2b:4cff dev switch0.10 proto babel metric 1024 onlink pref medium
2001:bf7:750:3700::/56 via fe80::1411:58ff:fe2b:4cff dev switch0.10 proto babel metric 1024 onlink pref medium
2001:bf7:750:3f00::/56 via fe80::1411:58ff:fe2b:4cff dev switch0.10 proto babel metric 1024 onlink pref medium
2001:bf7:750:4000::/56 via fe80::1411:58ff:fe2b:4cff dev switch0.10 proto babel metric 1024 onlink pref medium
2001:bf7:750:4100::/56 via fe80::1411:58ff:fe2b:4cff dev switch0.10 proto babel metric 1024 onlink pref medium
2001:bf7:750:4a00::/56 via fe80::1411:58ff:fe2b:4cff dev switch0.10 proto babel metric 1024 onlink pref medium
2001:bf7:750:4b00::/56 via fe80::1411:58ff:fe2b:4cff dev switch0.10 proto babel metric 1024 onlink pref medium
2001:bf7:750:5400::/56 via fe80::1411:58ff:fe2b:4cff dev switch0.10 proto babel metric 1024 onlink pref medium
2001:bf7:750:5600::/56 via fe80::1411:58ff:fe2b:4cff dev switch0.10 proto babel metric 1024 onlink pref medium
2001:bf7:760:1000::/56 via fe80::1411:58ff:fe2b:4cff dev switch0.10 proto babel metric 1024 onlink pref medium
2001:bf7:760:2200::/56 via fe80::1411:58ff:fe2b:4cff dev switch0.10 proto babel metric 1024 onlink pref medium
2001:bf7:760:2600::/56 via fe80::1411:58ff:fe2b:4cff dev switch0.10 proto babel metric 1024 onlink pref medium
2001:bf7:760:2700::/56 via fe80::1411:58ff:fe2b:4cff dev switch0.10 proto babel metric 1024 onlink pref medium
2001:bf7:760:2a00::/56 via fe80::1411:58ff:fe2b:4cff dev switch0.10 proto babel metric 1024 onlink pref medium
2001:bf7:760:2b00::/56 via fe80::1411:58ff:fe2b:4cff dev switch0.10 proto babel metric 1024 onlink pref medium
2001:bf7:760:2c00::/56 via fe80::1411:58ff:fe2b:4cff dev switch0.10 proto babel metric 1024 onlink pref medium
2001:bf7:790::/56 via fe80::1411:58ff:fe2b:4cff dev switch0.10 proto babel metric 1024 onlink pref medium
2001:bf7:800:f00::/56 via fe80::1411:58ff:fe2b:4cff dev switch0.10 proto babel metric 1024 onlink pref medium
2001:bf7:810:1000::/56 via fe80::1411:58ff:fe2b:4cff dev switch0.10 proto babel metric 1024 onlink pref medium
2001:bf7:820:300::/56 via fe80::1411:58ff:fe2b:4cff dev switch0.10 proto babel metric 1024 onlink pref medium
2001:bf7:820:800::/56 via fe80::1411:58ff:fe2b:4cff dev switch0.10 proto babel metric 1024 onlink pref medium
2001:bf7:820:e00::/56 via fe80::1411:58ff:fe2b:4cff dev switch0.10 proto babel metric 1024 onlink pref medium
2001:bf7:820:1000::/56 via fe80::1411:58ff:fe2b:4cff dev switch0.10 proto babel metric 1024 onlink pref medium
2001:bf7:820:1500::/56 via fe80::1411:58ff:fe2b:4cff dev switch0.10 proto babel metric 1024 onlink pref medium
2001:bf7:820:1800::/56 via fe80::1411:58ff:fe2b:4cff dev switch0.10 proto babel metric 1024 onlink pref medium
2001:bf7:820:2300::/56 via fe80::1411:58ff:fe2b:4cff dev switch0.10 proto babel metric 1024 onlink pref medium
2001:bf7:820:2400::/56 via fe80::1411:58ff:fe2b:4cff dev switch0.10 proto babel metric 1024 onlink pref medium
2001:bf7:820:2500::/56 via fe80::1411:58ff:fe2b:4cff dev switch0.10 proto babel metric 1024 onlink pref medium
2001:bf7:820:2600::/56 via fe80::1411:58ff:fe2b:4cff dev switch0.10 proto babel metric 1024 onlink pref medium
2001:bf7:830:b00::/56 via fe80::1411:58ff:fe2b:4cff dev switch0.10 proto babel metric 1024 onlink pref medium
2001:bf7:830:1f00::/56 via fe80::1411:58ff:fe2b:4cff dev switch0.10 proto babel metric 1024 onlink pref medium
2001:bf7:830:2600::/56 via fe80::1411:58ff:fe2b:4cff dev switch0.10 proto babel metric 1024 onlink pref medium
2001:bf7:830:3000::/56 via fe80::1411:58ff:fe2b:4cff dev switch0.10 proto babel metric 1024 onlink pref medium
2001:bf7:830:6700::/56 via fe80::1411:58ff:fe2b:4cff dev switch0.10 proto babel metric 1024 onlink pref medium
2001:bf7:830:8000::/56 via fe80::1411:58ff:fe2b:4cff dev switch0.10 proto babel metric 1024 onlink pref medium
2001:bf7:830:8200::/56 via fe80::1411:58ff:fe2b:4cff dev switch0.10 proto babel metric 1024 onlink pref medium
2001:bf7:830:8300::/56 via fe80::1411:58ff:fe2b:4cff dev switch0.10 proto babel metric 1024 onlink pref medium
2001:bf7:830:8400::/56 via fe80::1411:58ff:fe2b:4cff dev switch0.10 proto babel metric 1024 onlink pref medium
2001:bf7:830:8600::/56 via fe80::1411:58ff:fe2b:4cff dev switch0.10 proto babel metric 1024 onlink pref medium
2001:bf7:830:8800::/56 via fe80::1411:58ff:fe2b:4cff dev switch0.10 proto babel metric 1024 onlink pref medium
2001:bf7:830:8900::/56 via fe80::1411:58ff:fe2b:4cff dev switch0.10 proto babel metric 1024 onlink pref medium
2001:bf7:830:8b00::/56 via fe80::1411:58ff:fe2b:4cff dev switch0.10 proto babel metric 1024 onlink pref medium
2001:bf7:830:8c00::/56 via fe80::1411:58ff:fe2b:4cff dev switch0.10 proto babel metric 1024 onlink pref medium
2001:bf7:830:8e00::/56 via fe80::1411:58ff:fe2b:4cff dev switch0.10 proto babel metric 1024 onlink pref medium
2001:bf7:830:9000::/56 via fe80::1411:58ff:fe2b:4cff dev switch0.10 proto babel metric 1024 onlink pref medium
2001:bf7:830:9100::/56 via fe80::1411:58ff:fe2b:4cff dev switch0.10 proto babel metric 1024 onlink pref medium
2001:bf7:830:9200::/56 via fe80::1411:58ff:fe2b:4cff dev switch0.10 proto babel metric 1024 onlink pref medium
2001:bf7:830:9500::/56 via fe80::1411:58ff:fe2b:4cff dev switch0.10 proto babel metric 1024 onlink pref medium
2001:bf7:830:9800::/56 via fe80::1411:58ff:fe2b:4cff dev switch0.10 proto babel metric 1024 onlink pref medium
2001:bf7:830:9d00::/56 via fe80::1411:58ff:fe2b:4cff dev switch0.10 proto babel metric 1024 onlink pref medium
2001:bf7:830:9f00::/56 via fe80::1411:58ff:fe2b:4cff dev switch0.10 proto babel metric 1024 onlink pref medium
2001:bf7:830:a100::/56 via fe80::1411:58ff:fe2b:4cff dev switch0.10 proto babel metric 1024 onlink pref medium
2001:bf7:830:a200::/56 via fe80::1411:58ff:fe2b:4cff dev switch0.10 proto babel metric 1024 onlink pref medium
2001:bf7:830:a400::/56 via fe80::1411:58ff:fe2b:4cff dev switch0.10 proto babel metric 1024 onlink pref medium
2001:bf7:830:a500::/56 via fe80::1411:58ff:fe2b:4cff dev switch0.10 proto babel metric 1024 onlink pref medium
2001:bf7:830:a600::/56 via fe80::1411:58ff:fe2b:4cff dev switch0.10 proto babel metric 1024 onlink pref medium
2001:bf7:830:a700::/56 via fe80::1411:58ff:fe2b:4cff dev switch0.10 proto babel metric 1024 onlink pref medium
2001:bf7:830:ab00::/56 via fe80::1411:58ff:fe2b:4cff dev switch0.10 proto babel metric 1024 onlink pref medium
2001:bf7:830:ac00::/56 via fe80::1411:58ff:fe2b:4cff dev switch0.10 proto babel metric 1024 onlink pref medium
2001:bf7:830:ad00::/56 via fe80::1411:58ff:fe2b:4cff dev switch0.10 proto babel metric 1024 onlink pref medium
2001:bf7:830:b000::/56 via fe80::1411:58ff:fe2b:4cff dev switch0.10 proto babel metric 1024 onlink pref medium
2001:bf7:830:b100::/56 via fe80::1411:58ff:fe2b:4cff dev switch0.10 proto babel metric 1024 onlink pref medium
2001:bf7:830:b300::/58 via fe80::1411:58ff:fe2b:4cff dev switch0.10 proto babel metric 1024 onlink pref medium
2001:bf7:830:b380::/58 via fe80::1411:58ff:fe2b:4cff dev switch0.10 proto babel metric 1024 onlink pref medium
2001:bf7:830:b3c0::/58 via fe80::1411:58ff:fe2b:4cff dev switch0.10 proto babel metric 1024 onlink pref medium
2001:bf7:830:b600::/56 via fe80::1411:58ff:fe2b:4cff dev switch0.10 proto babel metric 1024 onlink pref medium
2001:bf7:830:b900::/56 via fe80::1411:58ff:fe2b:4cff dev switch0.10 proto babel metric 1024 onlink pref medium
2001:bf7:830:bb00::/56 via fe80::1411:58ff:fe2b:4cff dev switch0.10 proto babel metric 1024 onlink pref medium
2001:bf7:830:bc00::/56 via fe80::1411:58ff:fe2b:4cff dev switch0.10 proto babel metric 1024 onlink pref medium
2001:bf7:831::/56 via fe80::1411:58ff:fe2b:4cff dev switch0.10 proto babel metric 1024 onlink pref medium
2001:bf7:840:900::/56 via fe80::1411:58ff:fe2b:4cff dev switch0.10 proto babel metric 1024 onlink pref medium
2001:bf7:840:c00::/56 via fe80::1411:58ff:fe2b:4cff dev switch0.10 proto babel metric 1024 onlink pref medium
2001:bf7:860::/56 via fe80::1411:58ff:fe2b:4cff dev switch0.10 proto babel metric 1024 onlink pref medium
2001:bf7:860:b00::/56 via fe80::1411:58ff:fe2b:4cff dev switch0.10 proto babel metric 1024 onlink pref medium
2001:bf7:860:d00::/56 via fe80::1411:58ff:fe2b:4cff dev switch0.10 proto babel metric 1024 onlink pref medium
2001:bf7:860:f00::/64 dev switch0.40 proto kernel metric 256 pref medium
2001:bf7:860:f01::/64 dev switch0.42 proto kernel metric 256 pref medium
2001:bf7:860:fec::1 dev switch0.20 proto kernel metric 256 pref medium
2001:bf7:860:ff5::1 dev switch0.11 proto kernel metric 256 pref medium
2001:bf7:860:ff6::1 dev switch0.10 proto kernel metric 256 pref medium
2001:bf7:860:f00::/56 dev lo proto kernel metric 256 pref medium
fe80::/64 dev dsa proto kernel metric 256 pref medium
fe80::/64 dev switch0 proto kernel metric 256 pref medium
fe80::/64 dev switch0.10 proto kernel metric 256 pref medium
fe80::/64 dev switch0.11 proto kernel metric 256 pref medium
fe80::/64 dev switch0.20 proto kernel metric 256 pref medium
fe80::/64 dev switch0.40 proto kernel metric 256 pref medium
fe80::/64 dev switch0.42 proto kernel metric 256 pref medium
local ::1 dev lo table local proto kernel metric 0 pref medium
local 2001:bf7:860:f00:: dev lo table local proto kernel metric 0 pref medium
anycast 2001:bf7:860:f00:: dev switch0.40 table local proto kernel metric 0 pref medium
local 2001:bf7:860:f00::1 dev switch0.40 table local proto kernel metric 0 pref medium
anycast 2001:bf7:860:f01:: dev switch0.42 table local proto kernel metric 0 pref medium
local 2001:bf7:860:f01::1 dev switch0.42 table local proto kernel metric 0 pref medium
local 2001:bf7:860:fec::1 dev switch0.20 table local proto kernel metric 0 pref medium
local 2001:bf7:860:ff5::1 dev switch0.11 table local proto kernel metric 0 pref medium
local 2001:bf7:860:ff6::1 dev switch0.10 table local proto kernel metric 0 pref medium
anycast fe80:: dev dsa table local proto kernel metric 0 pref medium
anycast fe80:: dev switch0 table local proto kernel metric 0 pref medium
anycast fe80:: dev switch0.20 table local proto kernel metric 0 pref medium
anycast fe80:: dev switch0.11 table local proto kernel metric 0 pref medium
anycast fe80:: dev switch0.10 table local proto kernel metric 0 pref medium
anycast fe80:: dev switch0.42 table local proto kernel metric 0 pref medium
anycast fe80:: dev switch0.40 table local proto kernel metric 0 pref medium
local fe80::ff:fe00:1 dev switch0.40 table local proto kernel metric 0 pref medium
local fe80::6222:32ff:fe59:521f dev dsa table local proto kernel metric 0 pref medium
local fe80::6222:32ff:fe59:521f dev switch0 table local proto kernel metric 0 pref medium
local fe80::6222:32ff:fe59:521f dev switch0.20 table local proto kernel metric 0 pref medium
local fe80::6222:32ff:fe59:521f dev switch0.11 table local proto kernel metric 0 pref medium
local fe80::6222:32ff:fe59:521f dev switch0.10 table local proto kernel metric 0 pref medium
local fe80::6222:32ff:fe59:521f dev switch0.42 table local proto kernel metric 0 pref medium
multicast ff00::/8 dev switch0.10 table local proto kernel metric 256 pref medium
multicast ff00::/8 dev switch0.11 table local proto kernel metric 256 pref medium
multicast ff00::/8 dev switch0.20 table local proto kernel metric 256 pref medium
multicast ff00::/8 dev switch0.40 table local proto kernel metric 256 pref medium
multicast ff00::/8 dev switch0.42 table local proto kernel metric 256 pref medium
multicast ff00::/8 dev dsa table local proto kernel metric 256 pref medium
multicast ff00::/8 dev switch0 table local proto kernel metric 256 pref medium
```

More Infos about OLSR

```
~# cat /etc/config/olsrd
config LoadPlugin
	option library 'olsrd_arprefresh'

config LoadPlugin
	option library 'olsrd_nameservice'
	option suffix '.olsr'
	option hosts_file '/tmp/hosts/olsr'
	option latlon_file '/var/run/latlon.js'
	option services_file '/var/etc/services.olsr'
	list hosts '10.31.137.50 liese-21-magda'
	list hosts '10.31.137.51 liese-21-n-5ghz'
	list hosts '10.31.137.52 liese-21-n-nf-5ghz'

config LoadPlugin
	option accept '0.0.0.0'
	option library 'olsrd_jsoninfo'
	option ignore '0'

config LoadPlugin
	option accept '0.0.0.0'
	option library 'olsrd_txtinfo'
	option port '2006'

config olsrd
	option IpVersion '4'
	option FIBMetric 'flat'
	option AllowNoInt 'yes'
	option TcRedundancy '2'
	option NatThreshold '0.75'
	option LinkQualityAlgorithm 'etx_ff'
	option SmartGateway 'no'
	option SmartGatewayThreshold '50'
	option Pollrate '0.025'
	option SmartGatewaySpeed '45000 200000'
	option SmartGatewayUplink 'both'
	option LinkQualityLevel '2'
	option OlsrPort '698'
	option Willingness '3'
	option TosValue '16'

config InterfaceDefaults
	option MidValidityTime '500.0'
	option TcInterval '2.0'
	option HnaValidityTime '125.0'
	option HelloValidityTime '125.0'
	option TcValidityTime '500.0'
	option Ip4Broadcast '255.255.255.255'
	option MidInterval '25.0'
	option HelloInterval '3.0'
	option HnaInterval '10.0'

config Interface
	option ignore '0'
	option interface 'mesh_magda'
	option Mode 'mesh'

config Interface
	option ignore '0'
	option interface 'mesh_n_5ghz'
	option Mode 'mesh'

config Interface
	option ignore '0'
	option interface 'mesh_n_nf_5ghz'
	option Mode 'mesh'


# Network: dhcp
config Hna4
	option netmask '255.255.255.192'
	option netaddr '10.31.211.64'

# Network: mgmt
config Hna4
	option netmask '255.255.255.240'
	option netaddr '10.31.137.48'
root@liese-21-core:~# cat /tmp/etc/olsrd.conf 

DebugLevel 0
AllowNoInt yes
IpVersion 4
FIBMetric "flat"
TcRedundancy 2
NatThreshold 0.75
LinkQualityAlgorithm "etx_ff"
SmartGateway no
SmartGatewayThreshold 50
Pollrate 0.025
SmartGatewaySpeed 45000 200000
SmartGatewayUplink "both"
LinkQualityLevel 2
OlsrPort 698
Willingness 3
TosValue 16

Hna4
{
		10.31.211.64 255.255.255.192
		10.31.137.48 255.255.255.240
}

LoadPlugin "olsrd_arprefresh.so.0.1"
{
}

LoadPlugin "olsrd_nameservice.so.0.4"
{
	PlParam "name" "liese-21-core"
	PlParam "lat" "52.511259"
	PlParam "lon" "13.49598"
	PlParam "10.31.137.50" "liese-21-magda"
	PlParam "10.31.137.51" "liese-21-n-5ghz"
	PlParam "10.31.137.52" "liese-21-n-nf-5ghz"
	PlParam "suffix" ".olsr"
	PlParam "hosts-file" "/tmp/hosts/olsr"
	PlParam "latlon-file" "/var/run/latlon.js"
	PlParam "services-file" "/var/etc/services.olsr"
}

LoadPlugin "olsrd_jsoninfo.so.1.1"
{
	PlParam "accept" "0.0.0.0"
}

LoadPlugin "olsrd_txtinfo.so.1.1"
{
	PlParam "accept" "0.0.0.0"
	PlParam "port" "2006"
}

InterfaceDefaults
{
	MidValidityTime 500.0
	TcInterval 2.0
	HnaValidityTime 125.0
	HelloValidityTime 125.0
	TcValidityTime 500.0
	Ip4Broadcast 255.255.255.255
	MidInterval 25.0
	HelloInterval 3.0
	HnaInterval 10.0
}

Interface "switch0.10"
{
	Mode "mesh"
}

Interface "switch0.11"
{
	Mode "mesh"
}

Interface "switch0.20"
{
	Mode "mesh"
}

#Logread after OLSR-Restart
~# logread
Wed Jul 19 21:05:28 2023 daemon.warn odhcpd[1519]: No default route present, overriding ra_lifetime!
Wed Jul 19 21:05:29 2023 daemon.info olsrd[1971]: Writing '1' (was 0) to /proc/sys/net/ipv4/conf/all/send_redirects
Wed Jul 19 21:05:29 2023 daemon.info olsrd[1971]: Writing '1' (was 0) to /proc/sys/net/ipv4/conf/switch0.20/send_redirects
Wed Jul 19 21:05:29 2023 daemon.info olsrd[1971]: Writing '1' (was 0) to /proc/sys/net/ipv4/conf/switch0.11/send_redirects
Wed Jul 19 21:05:29 2023 daemon.info olsrd[1971]: Writing '1' (was 0) to /proc/sys/net/ipv4/conf/switch0.10/send_redirects
Wed Jul 19 21:05:29 2023 daemon.info olsrd[1971]: olsr.org - pre-0.9.9-git_0000000-hash_a5502f28e2ebade882de9b9a7315103c stopped
Wed Jul 19 21:05:29 2023 daemon.err olsrd[1971]: crash (logging a stack trace is not supported on this platform)
Wed Jul 19 21:05:29 2023 daemon.err olsrd[1971]: nested shutdown: exiting immediately (logging a stack trace is not supported on this platform)
Wed Jul 19 21:05:30 2023 daemon.info olsrd: /etc/init.d/olsrd: olsrd_setup_smartgw_rules() Warning: kmod-ipip is missing. SmartGateway will not work until you install it.
Wed Jul 19 21:05:30 2023 daemon.info olsrd[3734]: Writing '1' (was 1) to /proc/sys/net/ipv4/ip_forward
Wed Jul 19 21:05:30 2023 daemon.info olsrd[3734]: Writing '0' (was 1) to /proc/sys/net/ipv4/conf/all/send_redirects
Wed Jul 19 21:05:30 2023 daemon.info olsrd[3734]: Writing '0' (was 0) to /proc/sys/net/ipv4/conf/all/rp_filter
Wed Jul 19 21:05:30 2023 daemon.info olsrd[3734]: Writing '0' (was 1) to /proc/sys/net/ipv4/conf/switch0.10/send_redirects
Wed Jul 19 21:05:30 2023 daemon.info olsrd[3734]: Writing '0' (was 0) to /proc/sys/net/ipv4/conf/switch0.10/rp_filter
Wed Jul 19 21:05:30 2023 daemon.info olsrd[3734]: Adding interface switch0.10
Wed Jul 19 21:05:30 2023 daemon.info olsrd[3734]: New main address: 10.31.174.8
Wed Jul 19 21:05:30 2023 daemon.info olsrd[3734]: Writing '0' (was 1) to /proc/sys/net/ipv4/conf/switch0.11/send_redirects
Wed Jul 19 21:05:30 2023 daemon.info olsrd[3734]: Writing '0' (was 0) to /proc/sys/net/ipv4/conf/switch0.11/rp_filter
Wed Jul 19 21:05:30 2023 daemon.info olsrd[3734]: Adding interface switch0.11
Wed Jul 19 21:05:30 2023 daemon.info olsrd[3734]: Writing '0' (was 1) to /proc/sys/net/ipv4/conf/switch0.20/send_redirects
Wed Jul 19 21:05:30 2023 daemon.info olsrd[3734]: Writing '0' (was 0) to /proc/sys/net/ipv4/conf/switch0.20/rp_filter
Wed Jul 19 21:05:30 2023 daemon.info olsrd[3734]: Adding interface switch0.20
Wed Jul 19 21:05:30 2023 daemon.info olsrd[3734]: olsr.org - pre-0.9.9-git_0000000-hash_a5502f28e2ebade882de9b9a7315103c successfully started


~# olsrd-neigh 
Local       Remote      vTime  LQ       NLQ      Cost           Host 
10.31.174.8 10.31.83.61 105788 0.035000 1.000000 4194304.000000  

root@magda-core:~# olsrd-neigh 
Local       Remote       vTime  LQ       NLQ      Cost           Host 
10.31.83.61 10.31.40.174 136784 1.000000 1.000000 1.000000       liese-11-sw-core.olsr 
10.31.83.60 10.31.79.177 142347 1.000000 1.000000 1.000000       mid6.sama-core.olsr 
10.31.83.61 10.31.174.8  141295 1.000000 0.066000 4194304.000000 liese-21-core.olsr 
```
And dmesg
```
root@liese-21-core:~# dmesg
[    0.000000] Linux version 5.15.120 (builder@buildhost) (mipsel-openwrt-linux-musl-gcc (OpenWrt GCC 12.3.0 r23282-57e7188e63) 12.3.0, GNU ld (GNU Binutils) 2.40.0) #0 SMP Sat Jul 15 20:24:50 2023
[    0.000000] SoC Type: MediaTek MT7621 ver:1 eco:3
[    0.000000] printk: bootconsole [early0] enabled
[    0.000000] CPU0 revision is: 0001992f (MIPS 1004Kc)
[    0.000000] MIPS: machine is Ubiquiti UniFi Switch Flex
[    0.000000] Initrd not found or empty - disabling initrd
[    0.000000] VPE topology {2} total 2
[    0.000000] Primary instruction cache 32kB, VIPT, 4-way, linesize 32 bytes.
[    0.000000] Primary data cache 32kB, 4-way, PIPT, no aliases, linesize 32 bytes
[    0.000000] MIPS secondary cache 256kB, 8-way, linesize 32 bytes.
[    0.000000] Zone ranges:
[    0.000000]   Normal   [mem 0x0000000000000000-0x0000000007ffffff]
[    0.000000]   HighMem  empty
[    0.000000] Movable zone start for each node
[    0.000000] Early memory node ranges
[    0.000000]   node   0: [mem 0x0000000000000000-0x0000000007ffffff]
[    0.000000] Initmem setup node 0 [mem 0x0000000000000000-0x0000000007ffffff]
[    0.000000] percpu: Embedded 11 pages/cpu s14736 r8192 d22128 u45056
[    0.000000] pcpu-alloc: s14736 r8192 d22128 u45056 alloc=11*4096
[    0.000000] pcpu-alloc: [0] 0 [0] 1 
[    0.000000] Built 1 zonelists, mobility grouping on.  Total pages: 32480
[    0.000000] Kernel command line: console=ttyS0,115200
[    0.000000] Dentry cache hash table entries: 16384 (order: 4, 65536 bytes, linear)
[    0.000000] Inode-cache hash table entries: 8192 (order: 3, 32768 bytes, linear)
[    0.000000] Writing ErrCtl register=00074020
[    0.000000] Readback ErrCtl register=00074020
[    0.000000] mem auto-init: stack:off, heap alloc:off, heap free:off
[    0.000000] Memory: 119340K/131072K available (7307K kernel code, 625K rwdata, 880K rodata, 1220K init, 250K bss, 11732K reserved, 0K cma-reserved, 0K highmem)
[    0.000000] SLUB: HWalign=32, Order=0-3, MinObjects=0, CPUs=2, Nodes=1
[    0.000000] rcu: Hierarchical RCU implementation.
[    0.000000] rcu: 	RCU restricting CPUs from NR_CPUS=4 to nr_cpu_ids=2.
[    0.000000] 	Tracing variant of Tasks RCU enabled.
[    0.000000] rcu: RCU calculated value of scheduler-enlistment delay is 10 jiffies.
[    0.000000] rcu: Adjusting geometry for rcu_fanout_leaf=16, nr_cpu_ids=2
[    0.000000] NR_IRQS: 256
[    0.000000] clocksource: GIC: mask: 0xffffffffffffffff max_cycles: 0xcaf478abb4, max_idle_ns: 440795247997 ns
[    0.000003] sched_clock: 64 bits at 880MHz, resolution 1ns, wraps every 4398046511103ns
[    0.008029] Calibrating delay loop... 586.13 BogoMIPS (lpj=2930688)
[    0.066190] pid_max: default: 32768 minimum: 301
[    0.071566] Mount-cache hash table entries: 1024 (order: 0, 4096 bytes, linear)
[    0.078775] Mountpoint-cache hash table entries: 1024 (order: 0, 4096 bytes, linear)
[    0.090019] rcu: Hierarchical SRCU implementation.
[    0.095282] smp: Bringing up secondary CPUs ...
[    0.100638] Primary instruction cache 32kB, VIPT, 4-way, linesize 32 bytes.
[    0.100664] Primary data cache 32kB, 4-way, PIPT, no aliases, linesize 32 bytes
[    0.100678] MIPS secondary cache 256kB, 8-way, linesize 32 bytes.
[    0.100722] CPU1 revision is: 0001992f (MIPS 1004Kc)
[    0.159944] Synchronize counters for CPU 1: done.
[    0.189898] smp: Brought up 1 node, 2 CPUs
[    0.198891] clocksource: jiffies: mask: 0xffffffff max_cycles: 0xffffffff, max_idle_ns: 19112604462750000 ns
[    0.208671] futex hash table entries: 512 (order: 2, 16384 bytes, linear)
[    0.215681] pinctrl core: initialized pinctrl subsystem
[    0.222625] NET: Registered PF_NETLINK/PF_ROUTE protocol family
[    0.229190] thermal_sys: Registered thermal governor 'step_wise'
[    0.234500] FPU Affinity set after 11720 emulations
[    0.253309] clocksource: Switched to clocksource GIC
[    0.259600] NET: Registered PF_INET protocol family
[    0.264650] IP idents hash table entries: 2048 (order: 2, 16384 bytes, linear)
[    0.272703] tcp_listen_portaddr_hash hash table entries: 512 (order: 0, 6144 bytes, linear)
[    0.281008] Table-perturb hash table entries: 65536 (order: 6, 262144 bytes, linear)
[    0.288674] TCP established hash table entries: 1024 (order: 0, 4096 bytes, linear)
[    0.296287] TCP bind hash table entries: 1024 (order: 1, 8192 bytes, linear)
[    0.303267] TCP: Hash tables configured (established 1024 bind 1024)
[    0.309714] UDP hash table entries: 256 (order: 1, 8192 bytes, linear)
[    0.316211] UDP-Lite hash table entries: 256 (order: 1, 8192 bytes, linear)
[    0.323540] NET: Registered PF_UNIX/PF_LOCAL protocol family
[    0.329146] PCI: CLS 0 bytes, default 32
[    0.336077] workingset: timestamp_bits=14 max_order=15 bucket_order=1
[    0.348061] squashfs: version 4.0 (2009/01/31) Phillip Lougher
[    0.353947] jffs2: version 2.2 (NAND) (SUMMARY) (LZMA) (RTIME) (CMODE_PRIORITY) (c) 2001-2006 Red Hat, Inc.
[    0.365143] Block layer SCSI generic (bsg) driver version 0.4 loaded (major 251)
[    0.376046] mt7621_gpio 1e000600.gpio: registering 32 gpios
[    0.382067] mt7621_gpio 1e000600.gpio: registering 32 gpios
[    0.388082] mt7621_gpio 1e000600.gpio: registering 32 gpios
[    0.395500] Serial: 8250/16550 driver, 16 ports, IRQ sharing enabled
[    0.405787] printk: console [ttyS0] disabled
[    0.410138] 1e000c00.uartlite: ttyS0 at MMIO 0x1e000c00 (irq = 15, base_baud = 3125000) is a 16550A
[    0.419204] printk: console [ttyS0] enabled
[    0.427591] printk: bootconsole [early0] disabled
[    0.443534] spi-mt7621 1e000b00.spi: sys_freq: 220000000
[    0.450402] spi-nor spi0.0: mx25l12805d (16384 Kbytes)
[    0.455814] 7 fixed-partitions partitions found on MTD device spi0.0
[    0.462241] OF: Bad cell count for /palmbus@1e000000/spi@b00/flash@0/partitions
[    0.469663] OF: Bad cell count for /palmbus@1e000000/spi@b00/flash@0/partitions
[    0.477584] OF: Bad cell count for /palmbus@1e000000/spi@b00/flash@0/partitions
[    0.485002] OF: Bad cell count for /palmbus@1e000000/spi@b00/flash@0/partitions
[    0.492635] Creating 7 MTD partitions on "spi0.0":
[    0.497493] 0x000000000000-0x000000060000 : "u-boot"
[    0.503911] 0x000000060000-0x000000070000 : "u-boot-env"
[    0.510459] 0x000000070000-0x000000080000 : "factory"
[    0.516638] 0x000000080000-0x000000090000 : "eeprom"
[    0.522748] 0x000000090000-0x0000000a0000 : "bs"
[    0.528500] 0x0000000a0000-0x0000001a0000 : "cfg"
[    0.534432] 0x0000001a0000-0x000001000000 : "firmware"
[    0.540827] 2 fit-fw partitions found on MTD device firmware
[    0.546575] Creating 2 MTD partitions on "firmware":
[    0.551566] 0x000000000000-0x0000002b0000 : "kernel"
[    0.557874] 0x0000002ae39c-0x000000e60000 : "rootfs"
[    0.562880] mtd: partition "rootfs" doesn't start on an erase/write block boundary -- force read-only
[    0.573593] mtd: setting mtd8 (rootfs) as root device
[    0.578786] 1 squashfs-split partitions found on MTD device rootfs
[    0.585017] 0x000000a70000-0x000000e60000 : "rootfs_data"
[    0.726149] mt7530-mdio mdio-bus:1f: MT7530 adapts as multi-chip module
[    0.739605] mtk_soc_eth 1e100000.ethernet dsa: mediatek frame engine at 0xbe100000, irq 16
[    0.752770] mtk_soc_eth 1e100000.ethernet lan1: mediatek frame engine at 0xbe100000, irq 16
[    0.764796] i2c_dev: i2c /dev entries driver
[    0.772223] NET: Registered PF_INET6 protocol family
[    0.781240] Segment Routing with IPv6
[    0.785090] In-situ OAM (IOAM) with IPv6
[    0.789139] NET: Registered PF_PACKET protocol family
[    0.794360] bridge: filtering via arp/ip/ip6tables is no longer available by default. Update your scripts to load br_netfilter if you need this.
[    0.807905] 8021q: 802.1Q VLAN Support v1.8
[    0.818665] gpio-483 (sda): enforced open drain please flag it properly in DT/ACPI DSDT/board file
[    0.827824] gpio-484 (scl): enforced open drain please flag it properly in DT/ACPI DSDT/board file
[    0.837060] i2c-gpio i2c-gpio: using lines 483 (SDA) and 484 (SCL)
[    0.843708] mt7530-mdio mdio-bus:1f: MT7530 adapts as multi-chip module
[    0.870211] mt7530-mdio mdio-bus:1f: configuring for fixed/rgmii link mode
[    0.878011] mt7530-mdio mdio-bus:1f: Link is Up - 1Gbps/Full - flow control rx/tx
[    0.884222] mt7530-mdio mdio-bus:1f lan5 (uninitialized): PHY [mt7530-0:00] driver [MediaTek MT7530 PHY] (irq=18)
[    0.898710] mt7530-mdio mdio-bus:1f lan4 (uninitialized): PHY [mt7530-0:01] driver [MediaTek MT7530 PHY] (irq=19)
[    0.911517] mt7530-mdio mdio-bus:1f lan3 (uninitialized): PHY [mt7530-0:02] driver [MediaTek MT7530 PHY] (irq=20)
[    0.924488] mt7530-mdio mdio-bus:1f lan2 (uninitialized): PHY [mt7530-0:03] driver [MediaTek MT7530 PHY] (irq=21)
[    0.937179] DSA: tree 0 setup
[    0.948819] VFS: Mounted root (squashfs filesystem) readonly on device 31:8.
[    0.959842] Freeing unused kernel image (initmem) memory: 1220K
[    0.965818] This architecture does not have kernel memory protection.
[    0.972249] Run /sbin/init as init process
[    0.976337]   with arguments:
[    0.976345]     /sbin/init
[    0.976351]   with environment:
[    0.976356]     HOME=/
[    0.976361]     TERM=linux
[    1.476031] init: Console is alive
[    1.479825] init: - watchdog -
[    1.838071] kmodloader: loading kernel modules from /etc/modules-boot.d/*
[    1.908462] kmodloader: done loading kernel modules from /etc/modules-boot.d/*
[    1.926391] init: - preinit -
[    2.880170] random: jshn: uninitialized urandom read (4 bytes read)
[    3.014932] random: jshn: uninitialized urandom read (4 bytes read)
[    3.048800] random: jshn: uninitialized urandom read (4 bytes read)
[    3.712330] mtk_soc_eth 1e100000.ethernet lan1: PHY [mdio-bus:04] driver [MediaTek MT7530 PHY] (irq=POLL)
[    3.729414] mtk_soc_eth 1e100000.ethernet lan1: configuring for phy/rgmii link mode
[    6.037789] jffs2: notice: (410) jffs2_build_xattr_subsystem: complete building xattr subsystem, 21 of xdatum (15 unchecked, 6 orphan) and 26 of xref (6 dead, 0 orphan) found.
[    6.057019] mount_root: switching to jffs2 overlay
[    6.066430] overlayfs: upper fs does not support tmpfile.
[    6.097950] urandom-seed: Seeding with /etc/urandom.seed
[    6.247970] procd: - early -
[    6.251079] procd: - watchdog -
[    6.932364] procd: - watchdog -
[    6.936746] procd: - ubus -
[    7.066360] random: ubusd: uninitialized urandom read (4 bytes read)
[    7.075198] random: ubusd: uninitialized urandom read (4 bytes read)
[    7.082104] random: ubusd: uninitialized urandom read (4 bytes read)
[    7.095601] procd: - init -
[    7.938611] kmodloader: loading kernel modules from /etc/modules.d/*
[    8.016685] xt_time: kernel timezone is -0000
[    8.105469] kmodloader: done loading kernel modules from /etc/modules.d/*
[    8.109552] urngd: v1.0.2 started.
[    8.406523] random: crng init done
[    8.409960] random: 31 urandom warning(s) missed due to ratelimiting
[   15.410333] mtk_soc_eth 1e100000.ethernet lan1: PHY [mdio-bus:04] driver [MediaTek MT7530 PHY] (irq=POLL)
[   15.430059] mtk_soc_eth 1e100000.ethernet lan1: configuring for phy/rgmii link mode
[   15.453394] switch0: port 1(lan1) entered blocking state
[   15.458754] switch0: port 1(lan1) entered disabled state
[   15.464847] device lan1 entered promiscuous mode
[   15.580796] device switch0 entered promiscuous mode
[   15.643159] mtk_soc_eth 1e100000.ethernet dsa: configuring for fixed/rgmii link mode
[   15.656192] mtk_soc_eth 1e100000.ethernet dsa: Link is Up - 1Gbps/Full - flow control rx/tx
[   15.686466] IPv6: ADDRCONF(NETDEV_CHANGE): dsa: link becomes ready
[   15.706227] mt7530-mdio mdio-bus:1f lan2: configuring for phy/gmii link mode
[   15.737634] switch0: port 2(lan2) entered blocking state
[   15.742983] switch0: port 2(lan2) entered disabled state
[   15.770618] device lan2 entered promiscuous mode
[   15.775374] device dsa entered promiscuous mode
[   15.866906] mt7530-mdio mdio-bus:1f lan3: configuring for phy/gmii link mode
[   15.885893] switch0: port 3(lan3) entered blocking state
[   15.891283] switch0: port 3(lan3) entered disabled state
[   15.902598] device lan3 entered promiscuous mode
[   15.947082] mt7530-mdio mdio-bus:1f lan4: configuring for phy/gmii link mode
[   15.959791] switch0: port 4(lan4) entered blocking state
[   15.965286] switch0: port 4(lan4) entered disabled state
[   15.979690] device lan4 entered promiscuous mode
[   16.023198] mt7530-mdio mdio-bus:1f lan5: configuring for phy/gmii link mode
[   16.035814] switch0: port 5(lan5) entered blocking state
[   16.041210] switch0: port 5(lan5) entered disabled state
[   16.072109] device lan5 entered promiscuous mode
[   18.089294] mt7530-mdio mdio-bus:1f lan2: Link is Up - 1Gbps/Full - flow control rx/tx
[   18.113583] switch0: port 2(lan2) entered blocking state
[   18.118958] switch0: port 2(lan2) entered forwarding state
[   18.143833] IPv6: ADDRCONF(NETDEV_CHANGE): switch0: link becomes ready
[   18.161800] IPv6: ADDRCONF(NETDEV_CHANGE): switch0.10: link becomes ready
[   18.169348] IPv6: ADDRCONF(NETDEV_CHANGE): switch0.11: link becomes ready
[   18.176734] IPv6: ADDRCONF(NETDEV_CHANGE): switch0.20: link becomes ready
[   18.184122] IPv6: ADDRCONF(NETDEV_CHANGE): switch0.40: link becomes ready
[   18.191472] IPv6: ADDRCONF(NETDEV_CHANGE): switch0.42: link becomes ready
[   18.251375] mt7530-mdio mdio-bus:1f lan3: Link is Up - 1Gbps/Full - flow control rx/tx
[   18.273813] switch0: port 3(lan3) entered blocking state
[   18.279181] switch0: port 3(lan3) entered forwarding state
```

tcpdump

```
~# tcpdump -i switch0.10 port 698
tcpdump: verbose output suppressed, use -v[v]... for full protocol decode
listening on switch0.10, link-type EN10MB (Ethernet), snapshot length 262144 bytes
21:36:20.984714 IP 10.31.83.61.698 > 255.255.255.255.698: OLSRv4, seq 0xba9f, length 376
21:36:21.423760 IP liese-21-core.olsr.698 > 255.255.255.255.698: OLSRv4, seq 0x271a, length 32
21:36:23.773036 IP 10.31.83.61.698 > 255.255.255.255.698: OLSRv4, seq 0xbaa9, length 1456
21:36:24.857467 IP liese-21-core.olsr.698 > 255.255.255.255.698: OLSRv4, seq 0x271b, length 76
21:36:26.690143 IP liese-21-core.olsr.698 > 255.255.255.255.698: OLSRv4, seq 0x271c, length 28
21:36:28.196271 IP liese-21-core.olsr.698 > 255.255.255.255.698: OLSRv4, seq 0x271d, length 84
21:36:29.851059 IP liese-21-core.olsr.698 > 255.255.255.255.698: OLSRv4, seq 0x271e, length 48
21:36:31.456506 IP liese-21-core.olsr.698 > 255.255.255.255.698: OLSRv4, seq 0x271f, length 20
21:36:31.494390 IP 10.31.83.61.698 > 255.255.255.255.698: OLSRv4, seq 0xbace, length 76
21:36:31.624196 IP 10.31.83.61.698 > 255.255.255.255.698: OLSRv4, seq 0xbacf, length 1440

# mit -v

tcpdump: listening on switch0.10, link-type EN10MB (Ethernet), snapshot length 262144 bytes
21:40:01.250385 IP (tos 0x10, ttl 64, id 35918, offset 0, flags [DF], proto UDP (17), length 60)
    liese-21-core.olsr.698 > 255.255.255.255.698: OLSRv4, seq 0x2780, length 32
	Hello-LQ Message (0xc9), originator liese-21-core.olsr, ttl 1, hop 0
	  vtime 124.000s, msg-seq 0x53a9, length 28
	  hello-time 3.000s, MPR willingness 3
	    link-type Symmetric, neighbor-type Symmetric, len 12
	      neighbor 10.31.83.61, link-quality 2.35%, neighbor-link-quality 100.00%
21:40:03.231200 IP (tos 0x10, ttl 64, id 36112, offset 0, flags [DF], proto UDP (17), length 88)
    liese-21-core.olsr.698 > 255.255.255.255.698: OLSRv4, seq 0x2781, length 60
	HNA Message (0x04), originator liese-21-core.olsr, ttl 255, hop 0
	  vtime 124.000s, msg-seq 0x53ad, length 28
	  Advertised networks (total 2)
	    10.31.137.48/28, 10.31.211.64/26
	Hello-LQ Message (0xc9), originator liese-21-core.olsr, ttl 1, hop 0
	  vtime 124.000s, msg-seq 0x53af, length 28
	  hello-time 3.000s, MPR willingness 3
	    link-type Symmetric, neighbor-type Symmetric, len 12
	      neighbor 10.31.83.61, link-quality 3.14%, neighbor-link-quality 100.00%
21:40:03.393233 IP (tos 0x10, ttl 64, id 16330, offset 0, flags [DF], proto UDP (17), length 1456)
    10.31.83.61.698 > 255.255.255.255.698: OLSRv4, seq 0xbe99, length 1428
	TC-LQ Message (0xca), originator ohlauer-gw.olsr, ttl 12, hop 4
	  vtime 496.000s, msg-seq 0xbc0e, length 72
	    advertised neighbor seq 0x9928
	      neighbor 10.30.96.43, link-quality 19.61%, neighbor-link-quality 100.00%
	      neighbor emma-core.olsr, link-quality 100.00%, neighbor-link-quality 100.00%
	      neighbor 10.31.142.112, link-quality 19.61%, neighbor-link-quality 39.61%
	      neighbor habersaath-core.olsr, link-quality 19.61%, neighbor-link-quality 89.80%
	      neighbor 10.31.152.176, link-quality 19.61%, neighbor-link-quality 39.61%
	      neighbor 10.31.161.156, link-quality 19.61%, neighbor-link-quality 39.61%
	      neighbor 10.31.179.120, link-quality 19.61%, neighbor-link-quality 39.61%
	MID Message (0x03), originator 10.31.96.16, ttl 250, hop 5
	  vtime 496.000s, msg-seq 0x029f, length 16
	  interface address 10.31.96.25
	MID Message (0x03), originator 10.31.68.72, ttl 250, hop 5
	  vtime 496.000s, msg-seq 0xa7f6, length 20
	  interface address 10.31.153.97
	  interface address 10.31.153.96
	TC-LQ Message (0xca), originator 10.31.130.160, ttl 249, hop 6
	  vtime 496.000s, msg-seq 0xb8cb, length 72
	    advertised neighbor seq 0xbad9
	      neighbor philmel-core.olsr, link-quality 100.00%, neighbor-link-quality 17.25%
	      neighbor 10.31.131.32, link-quality 95.69%, neighbor-link-quality 100.00%
	      neighbor 10.31.212.33, link-quality 19.61%, neighbor-link-quality 37.25%
	      neighbor 10.31.142.112, link-quality 19.61%, neighbor-link-quality 39.61%
	      neighbor l5-core.olsr, link-quality 19.61%, neighbor-link-quality 39.61%
	      neighbor 10.31.152.176, link-quality 19.61%, neighbor-link-quality 39.61%
	      neighbor a.bbb-vpn.olsr, link-quality 29.80%, neighbor-link-quality 100.00%
	TC-LQ Message (0xca), originator kirchhof-core.olsr, ttl 11, hop 5
	  vtime 496.000s, msg-seq 0x3b1a, length 24
	    advertised neighbor seq 0x001e
	      neighbor 10.31.127.160, link-quality 39.61%, neighbor-link-quality 19.61%
	HNA Message (0x04), originator 10.31.29.42, ttl 248, hop 7
	  vtime 124.000s, msg-seq 0x46ca, length 20
	  Advertised networks (total 1)
	    10.31.196.64/28
	HNA Message (0x04), originator 10.31.30.33, ttl 249, hop 6
	  vtime 124.000s, msg-seq 0x8050, length 28
	  Advertised networks (total 2)
	    10.31.187.0/25, 10.31.30.32/30
	HNA Message (0x04), originator s--35.olsr, ttl 251, hop 4
	  vtime 124.000s, msg-seq 0xfec7, length 28
	  Advertised networks (total 2)
	    10.31.152.232/30, 10.31.153.64/27
	TC-LQ Message (0xca), originator 10.31.79.176, ttl 1, hop 1
	  vtime 496.000s, msg-seq 0x2ba8, length 120
	    advertised neighbor seq 0x0f0f
	      neighbor 10.31.161.8, link-quality 100.00%, neighbor-link-quality 100.00%
	      neighbor 10.31.115.32, link-quality 100.00%, neighbor-link-quality 100.00%
	      neighbor gruni73-core.olsr, link-quality 100.00%, neighbor-link-quality 100.00%
	      neighbor 10.31.83.56, link-quality 100.00%, neighbor-link-quality 100.00%
	      neighbor 10.31.83.60, link-quality 100.00%, neighbor-link-quality 100.00%
	      neighbor rigaer78-core.olsr, link-quality 100.00%, neighbor-link-quality 100.00%
	      neighbor rigaer83-core.olsr, link-quality 100.00%, neighbor-link-quality 100.00%
	      neighbor 10.31.97.67, link-quality 100.00%, neighbor-link-quality 100.00%
	      neighbor wilgu10-core.olsr, link-quality 100.00%, neighbor-link-quality 100.00%
	      neighbor 10.31.252.192, link-quality 100.00%, neighbor-link-quality 49.80%
	      neighbor scharni29-freifunk.olsr, link-quality 100.00%, neighbor-link-quality 100.00%
	      neighbor 10.31.96.216, link-quality 100.00%, neighbor-link-quality 100.00%
	      neighbor 10.31.74.220, link-quality 100.00%, neighbor-link-quality 100.00%
	TC-LQ Message (0xca), originator 10.31.97.67, ttl 14, hop 2
	  vtime 496.000s, msg-seq 0x6ed5, length 32
	    advertised neighbor seq 0x206d
	      neighbor 10.31.7.1, link-quality 29.80%, neighbor-link-quality 100.00%
	      neighbor 10.31.79.176, link-quality 100.00%, neighbor-link-quality 100.00%
	HNA Message (0x04), originator 10.230.226.225, ttl 250, hop 5
	  vtime 124.000s, msg-seq 0x6967, length 28
	  Advertised networks (total 2)
	    10.230.226.224/27, 10.230.229.0/24
	TC-LQ Message (0xca), originator 10.230.226.225, ttl 11, hop 5
	  vtime 496.000s, msg-seq 0x6968, length 56
	    advertised neighbor seq 0x0044
	      neighbor 10.230.23.141, link-quality 69.41%, neighbor-link-quality 100.00%
	      neighbor 10.36.243.192, link-quality 100.00%, neighbor-link-quality 100.00%
	      neighbor 10.230.226.212, link-quality 100.00%, neighbor-link-quality 100.00%
	      neighbor basta.olsr, link-quality 100.00%, neighbor-link-quality 100.00%
	      neighbor 10.230.226.215, link-quality 100.00%, neighbor-link-quality 100.00%
	HNA Message (0x04), originator 10.31.20.141, ttl 249, hop 6
	  vtime 124.000s, msg-seq 0x9ac2, length 28
	  Advertised networks (total 2)
	    10.230.36.28/30, 10.31.174.96/28
	TC-LQ Message (0xca), originator 10.31.20.141, ttl 2, hop 6
[...]
```
Logread from next morning:
```
Thu Jul 20 07:15:00 2023 cron.err crond[3335]: USER root pid 7292 cmd killall -HUP dnsmasq
Thu Jul 20 07:15:00 2023 daemon.info dnsmasq[1]: read /etc/hosts - 12 names
Thu Jul 20 07:15:00 2023 daemon.info dnsmasq[1]: read /tmp/hosts/dhcp.cfg01411c - 10 names
Thu Jul 20 07:15:00 2023 daemon.info dnsmasq[1]: read /tmp/hosts/olsr - 1373 names
Thu Jul 20 07:15:00 2023 daemon.info dnsmasq-dhcp[1]: read /etc/ethers - 0 addresses
Thu Jul 20 07:15:01 2023 daemon.err collectd[2147]: network plugin: getaddrinfo (monitor.berlin.freifunk.net, (null)) failed: Try again
Thu Jul 20 07:15:18 2023 daemon.warn odhcpd[1519]: No default route present, overriding ra_lifetime!
Thu Jul 20 07:15:18 2023 daemon.warn odhcpd[1519]: No default route present, overriding ra_lifetime!
Thu Jul 20 07:16:06 2023 daemon.err collectd[2147]: network plugin: getaddrinfo (monitor.berlin.freifunk.net, (null)) failed: Try again
Thu Jul 20 07:17:00 2023 cron.err crond[3335]: USER root pid 7293 cmd test -e /usr/sbin/owm.sh && /usr/sbin/owm.sh
Thu Jul 20 07:17:28 2023 daemon.err collectd[2147]: network plugin: Successfully resolved "monitor.berlin.freifunk.net".
Thu Jul 20 07:20:00 2023 cron.err crond[3335]: USER root pid 7387 cmd killall -HUP dnsmasq
Thu Jul 20 07:20:00 2023 daemon.info dnsmasq[1]: read /etc/hosts - 12 names
Thu Jul 20 07:20:00 2023 daemon.info dnsmasq[1]: read /tmp/hosts/dhcp.cfg01411c - 10 names
Thu Jul 20 07:20:00 2023 daemon.info dnsmasq[1]: read /tmp/hosts/olsr - 1373 names
Thu Jul 20 07:20:00 2023 daemon.info dnsmasq-dhcp[1]: read /etc/ethers - 0 addresses
Thu Jul 20 07:25:00 2023 cron.err crond[3335]: USER root pid 7396 cmd killall -HUP dnsmasq
```

**Comment by FFHener** [comment]
The issue occured again, it looks like a olsr-problem:

```
root@liese-21-core:~# wget -O - http://127.0.0.1:2006 > olsr.txt

root@liese-21-core:~# cat olsr.txt 
Table: Neighbors
IP address	SYM	MPR	MPRS	Will.	2-hop count
10.31.83.60	YES	YES	NO	3	1

Table: Links
Local IP	Remote IP	Hyst.	LQ	NLQ	Cost
10.31.174.8	10.31.83.61	0.000	0.016	1.000	INFINITE

Table: Routes
Destination	Gateway IP	Metric	ETX	Interface

Table: HNA
Destination	Gateway
10.31.137.48/28	10.31.174.8
10.31.211.64/26	10.31.174.8
10.31.127.96/27	10.31.124.199
10.31.81.0/27	10.31.79.176
10.31.81.128/25	10.31.79.176
10.36.102.0/25	10.36.102.129
10.36.102.128/30	10.36.102.129
10.36.102.132/30	10.36.102.129
10.36.102.136/30	10.36.102.129
0.0.0.0/0	10.36.102.129
10.31.228.192/26	10.31.228.160
10.31.228.128/27	10.31.228.160
10.31.108.16/28	10.31.104.220
10.31.183.192/26	10.31.183.145
10.31.183.160/27	10.31.183.145
10.31.183.128/28	10.31.183.145
10.31.173.160/27	10.31.173.144
10.31.173.128/28	10.31.173.144
10.36.69.96/27	10.31.28.17
10.36.160.56/30	10.31.28.17
10.31.130.128/27	10.31.130.160
0.0.0.0/0	10.31.130.160
10.31.161.208/28	10.31.161.168
10.31.78.240/28	10.31.78.131
10.31.85.208/28	10.31.42.89
10.230.205.8/29	10.36.254.82
10.36.90.224/27	10.31.29.65
10.31.83.48/29	10.31.83.56
10.230.106.16/28	10.31.14.203
10.31.127.80/28	10.31.124.205
10.31.83.112/28	10.31.83.60
10.31.83.192/26	10.31.83.60
10.230.104.0/28	10.31.14.148
10.31.199.0/26	10.31.199.254
10.230.162.144/28	10.31.19.208
10.36.243.160/30	10.36.243.192
10.36.243.164/30	10.36.243.192
10.36.243.168/30	10.36.243.192
10.36.243.172/30	10.36.243.192
10.36.243.176/30	10.36.243.192
10.36.243.180/30	10.36.243.192
10.36.243.184/30	10.36.243.192
10.36.244.0/24	10.36.243.192
10.36.243.128/28	10.36.243.192
10.230.108.96/28	10.31.14.154

Table: MID
IP address	(Alias)+
10.31.27.245		10.36.193.101
10.31.104.220		10.31.104.221
10.31.36.45		10.36.197.233
10.31.3.226		10.36.193.186
10.31.97.67		10.31.97.68
10.31.28.17		10.36.160.57	10.31.28.18
10.36.254.75		10.36.254.76
10.31.155.203		10.31.155.204
10.31.11.33		10.31.11.45	10.31.11.40	10.31.11.39	10.31.11.38	10.31.11.37	10.31.11.36	10.31.11.35	10.31.11.34
10.31.153.96		10.31.68.72
10.230.38.204		10.36.197.3	10.36.197.5	10.36.197.6	10.230.38.205
10.36.254.66		10.36.254.93	10.230.51.105	10.36.193.218
10.31.157.97		10.31.157.103	10.31.157.112	10.31.157.111	10.31.157.110	10.31.157.100	10.31.157.99	10.31.157.98
10.31.213.64		10.31.213.70	10.31.213.69	10.31.213.68	10.31.213.67	10.31.213.73	10.31.213.72	10.31.213.71	10.31.213.66	10.31.213.65
10.31.156.32		10.31.156.42	10.31.156.41	10.31.156.40	10.31.156.33
10.31.3.38		10.36.193.251	10.31.3.39
10.36.254.82		10.230.205.9	10.230.51.109	10.36.254.83
10.31.124.209		10.31.124.217	10.230.69.233	10.31.39.241
10.31.51.136		10.31.51.139	10.31.51.138	10.31.51.137
10.31.12.9		10.36.197.218
10.31.40.196		10.36.193.24
10.31.83.56		10.31.141.3	10.31.141.1	10.31.141.2	10.31.83.58	10.31.83.57
10.31.53.25		10.31.201.250	10.31.53.26
10.30.96.43		10.31.40.125	10.31.40.124	10.30.96.47	10.30.96.46	10.30.96.45	10.30.96.44
10.230.210.104		10.230.210.106	10.230.210.105
10.36.254.69		10.36.254.70
10.31.43.108		10.31.43.109
10.31.7.37		10.31.7.36
10.31.48.1		10.31.48.3	10.31.48.2
10.31.83.60		10.31.83.61
10.31.167.208		10.31.167.210	10.31.167.209
10.31.6.64		10.31.6.79	10.31.6.78	10.31.6.77	10.31.6.76	10.31.6.75	10.31.6.74	10.31.6.73	10.31.6.72	10.31.6.71	10.31.6.70	10.31.6.69	10.31.6.68	10.31.6.67	10.31.6.66	10.31.6.65
10.31.151.112		10.31.151.119	10.31.151.118	10.31.151.117	10.31.151.116	10.31.151.115	10.31.151.114	10.31.151.113
10.31.96.102		10.31.96.103
10.31.108.109		10.36.197.161
10.31.71.152		10.31.71.155	10.31.71.154	10.31.71.153
10.31.38.232		10.36.193.117	10.31.38.233
10.230.192.224		10.230.192.230	10.230.192.229	10.230.192.228	10.230.192.227	10.230.192.226	10.230.192.225
10.31.8.147		10.36.193.179	10.31.8.148
10.31.191.160		10.31.191.161
10.230.226.215		10.230.226.193	10.230.226.222
10.31.37.8		10.31.37.9
10.31.111.113		10.36.197.130	10.31.111.112
10.31.24.144		10.31.24.58	10.31.24.145
10.31.34.185		10.31.34.184
10.31.30.189		10.36.197.220	10.31.96.221	10.31.30.190
10.31.78.57		10.36.193.220
10.31.115.32		10.31.115.48	10.31.115.46	10.31.115.45	10.31.115.44	10.31.115.42	10.31.115.41	10.31.115.40	10.31.115.39	10.31.115.38	10.31.115.36	10.31.115.35	10.31.115.34	10.31.115.33

Table: Topology
Dest. IP	Last hop IP	LQ	NLQ	Cost
10.31.7.37	10.31.7.1	1.000	1.000	INFINITE
10.31.97.67	10.31.7.1	1.000	0.298	INFINITE
10.31.2.85	10.31.7.1	1.000	1.000	INFINITE
10.31.16.17	10.31.27.1	1.000	1.000	1.000
10.31.130.160	10.31.48.1	1.000	1.000	INFINITE
10.36.243.192	10.31.48.1	1.000	0.917	INFINITE
10.31.131.192	10.36.137.1	0.983	1.000	1.016
10.31.157.97	10.31.21.8	0.991	0.282	3.569
10.31.40.176	10.31.37.8	0.419	1.000	2.383
10.31.69.32	10.230.3.10	0.662	0.991	1.521
10.31.44.114	10.230.3.10	1.000	1.000	1.000
10.31.126.128	10.230.3.10	1.000	1.000	1.000
10.31.71.152	10.230.3.10	1.000	1.000	1.000
10.31.130.160	10.230.3.10	1.000	1.000	1.000
10.31.160.241	10.230.3.10	1.000	1.000	1.000
10.31.107.15	10.31.107.12	1.000	1.000	INFINITE
10.31.75.208	10.31.107.12	1.000	0.843	INFINITE
10.31.107.12	10.31.107.15	1.000	1.000	1.000
10.230.7.71	10.31.107.15	1.000	1.000	1.000
10.31.77.254	10.31.107.15	1.000	1.000	1.000
10.31.11.33	10.31.8.16	1.000	1.000	INFINITE
10.31.27.1	10.31.16.17	1.000	1.000	INFINITE
10.31.11.33	10.31.23.24	1.000	1.000	INFINITE
10.31.98.188	10.31.23.24	1.000	1.000	INFINITE
10.31.11.96	10.31.112.24	1.000	0.195	5.100
10.31.173.144	10.31.112.24	1.000	1.000	1.000
10.31.153.96	10.31.53.25	1.000	1.000	1.000
10.230.104.160	10.35.255.25	1.000	0.246	INFINITE
10.230.3.10	10.31.69.32	0.979	0.611	INFINITE
10.31.212.33	10.31.115.32	1.000	1.000	1.000
10.31.109.64	10.31.115.32	1.000	1.000	1.000
10.31.157.97	10.31.115.32	1.000	1.000	1.000
10.230.89.128	10.31.115.32	1.000	1.000	1.000
10.31.38.170	10.31.115.32	1.000	1.000	1.000
10.31.79.176	10.31.115.32	1.000	1.000	1.000
10.31.167.208	10.31.115.32	1.000	1.000	1.000
10.31.126.128	10.31.125.32	1.000	1.000	1.000
10.31.8.16	10.31.11.33	1.000	1.000	1.000
10.31.23.24	10.31.11.33	1.000	1.000	1.000
10.31.11.96	10.31.11.33	1.000	1.000	1.000
10.31.38.170	10.31.11.33	1.000	0.784	1.274
10.31.98.188	10.31.11.33	1.000	1.000	1.000
10.31.167.208	10.31.11.33	0.890	0.972	1.154
10.31.34.45	10.31.30.33	1.000	1.000	1.000
10.31.126.128	10.31.30.33	1.000	1.000	1.000
10.31.115.32	10.31.212.33	1.000	1.000	INFINITE
10.31.79.176	10.31.212.33	1.000	1.000	INFINITE
10.31.7.1	10.31.7.37	1.000	1.000	1.000
10.31.2.85	10.31.7.37	1.000	1.000	1.000
10.230.104.160	10.36.193.37	1.000	0.246	4.047
10.31.40.233	10.31.21.40	0.956	1.000	INFINITE
10.31.11.96	10.30.96.43	1.000	0.195	5.100
10.31.127.160	10.30.96.43	1.000	0.195	5.100
10.31.30.33	10.31.34.45	1.000	1.000	1.000
10.31.126.128	10.31.34.45	1.000	1.000	1.000
10.31.92.240	10.31.34.45	0.502	0.796	2.502
10.31.226.145	10.31.85.49	0.940	0.713	INFINITE
10.31.226.209	10.31.85.49	0.121	0.137	INFINITE
10.30.96.254	10.30.96.54	1.000	0.757	INFINITE
10.230.104.160	10.31.97.54	1.000	0.246	INFINITE
10.31.35.169	10.31.97.54	1.000	1.000	INFINITE
10.31.79.176	10.31.83.60	1.000	1.000	1.000
10.230.104.160	10.31.25.64	1.000	0.246	4.047
10.31.115.32	10.31.109.64	1.000	1.000	1.000
10.31.79.176	10.31.109.64	1.000	1.000	1.000
10.31.130.160	10.31.213.64	1.000	1.000	1.000
10.230.18.161	10.31.213.64	1.000	1.000	1.000
10.230.104.160	10.31.29.65	1.000	0.246	INFINITE
10.31.159.128	10.31.151.65	0.682	0.819	1.787
10.31.157.160	10.31.151.65	1.000	1.000	1.000
10.31.226.209	10.31.151.65	0.337	0.345	8.592
10.31.79.176	10.31.79.67	1.000	1.000	INFINITE
10.31.7.1	10.31.97.67	0.298	0.827	INFINITE
10.31.79.176	10.31.97.67	1.000	1.000	INFINITE
10.31.107.15	10.230.7.71	1.000	1.000	1.000
10.36.254.75	10.36.254.73	1.000	1.000	INFINITE
10.36.254.73	10.36.254.75	1.000	1.000	1.000
10.36.254.82	10.36.254.75	0.886	0.674	1.672
10.230.104.160	10.36.193.76	1.000	0.246	INFINITE
10.31.126.128	10.31.45.78	1.000	1.000	INFINITE
10.36.254.75	10.36.254.82	0.674	0.952	1.556
10.31.7.1	10.31.2.85	1.000	1.000	INFINITE
10.31.7.37	10.31.2.85	1.000	1.000	INFINITE
10.31.112.24	10.31.11.96	0.195	1.000	5.100
10.31.11.33	10.31.11.96	1.000	1.000	1.000
10.30.96.43	10.31.11.96	0.195	1.000	5.100
10.31.183.145	10.31.11.96	0.195	1.000	5.100
10.31.53.25	10.31.153.96	1.000	1.000	1.000
10.31.130.160	10.31.153.96	1.000	0.195	5.100
10.31.20.141	10.31.54.97	1.000	1.000	INFINITE
10.230.23.141	10.31.54.97	1.000	1.000	INFINITE
10.31.21.8	10.31.157.97	0.282	1.000	3.541
10.31.115.32	10.31.157.97	1.000	1.000	1.000
10.31.43.108	10.31.157.97	0.298	0.979	3.422
10.31.79.176	10.31.157.97	1.000	1.000	1.000
10.31.131.192	10.230.210.97	1.000	1.000	1.000
10.31.96.102	10.31.111.100	1.000	1.000	INFINITE
10.31.104.220	10.31.111.100	1.000	0.909	INFINITE
10.31.111.100	10.31.96.102	1.000	1.000	1.000
10.31.104.220	10.31.96.102	0.983	0.843	1.204
10.31.35.212	10.31.13.104	0.607	1.000	INFINITE
10.31.79.176	10.230.210.104	1.000	1.000	INFINITE
10.230.104.160	10.36.193.105	1.000	0.246	4.047
10.31.25.176	10.31.22.107	0.890	0.886	1.267
10.31.157.97	10.31.43.108	0.968	0.298	3.464
10.230.104.160	10.31.38.109	1.000	0.246	4.047
10.31.75.208	10.31.45.111	1.000	1.000	1.000
10.31.77.254	10.31.42.112	0.972	0.886	1.160
10.230.104.160	10.36.193.112	1.000	0.246	4.047
10.230.3.10	10.31.44.114	1.000	1.000	1.000
10.230.104.160	10.36.193.116	1.000	0.246	INFINITE
10.31.77.254	10.31.1.128	1.000	1.000	1.000
10.230.104.160	10.31.39.128	1.000	0.246	INFINITE
10.31.115.32	10.230.89.128	1.000	1.000	1.000
10.31.51.136	10.230.89.128	0.489	1.000	2.039
10.230.3.10	10.31.126.128	1.000	1.000	1.000
10.31.125.32	10.31.126.128	1.000	1.000	1.000
10.31.30.33	10.31.126.128	1.000	1.000	1.000
10.31.34.45	10.31.126.128	1.000	1.000	1.000
10.31.45.78	10.31.126.128	1.000	1.000	1.000
10.31.51.136	10.31.126.128	1.000	1.000	1.000
10.31.127.160	10.31.126.128	1.000	1.000	1.000
10.31.131.192	10.31.126.128	1.000	1.000	1.000
10.31.92.240	10.31.126.128	1.000	1.000	1.000
10.31.151.65	10.31.159.128	0.968	0.662	1.558
10.31.157.160	10.31.159.128	0.937	1.000	1.066
10.31.13.208	10.36.102.129	1.000	1.000	INFINITE
10.230.23.141	10.230.242.133	1.000	1.000	1.000
10.230.11.198	10.230.242.133	1.000	1.000	1.000
10.230.89.128	10.31.51.136	1.000	0.489	2.039
10.31.126.128	10.31.51.136	1.000	1.000	1.000
10.31.30.155	10.31.51.136	1.000	1.000	1.000
10.31.54.97	10.31.20.141	1.000	1.000	INFINITE
10.31.54.97	10.230.23.141	1.000	1.000	1.000
10.230.242.133	10.230.23.141	1.000	1.000	1.000
10.230.18.161	10.230.23.141	1.000	1.000	1.000
10.36.243.192	10.230.23.141	1.000	1.000	1.000
10.230.11.198	10.230.23.141	1.000	1.000	1.000
10.31.34.213	10.230.23.141	1.000	1.000	1.000
10.31.112.24	10.31.173.144	1.000	1.000	1.000
10.31.11.96	10.31.183.145	1.000	0.195	5.100
10.31.85.49	10.31.226.145	0.878	0.894	1.272
10.230.104.160	10.31.8.147	1.000	0.246	4.047
10.230.11.198	10.31.51.150	1.000	1.000	1.000
10.31.54.217	10.31.51.150	1.000	1.000	1.000
10.31.54.222	10.31.51.150	1.000	1.000	1.000
10.230.3.10	10.31.71.152	1.000	1.000	1.000
10.230.104.160	10.31.28.153	1.000	0.246	4.047
10.31.51.136	10.31.30.155	1.000	1.000	INFINITE
10.35.255.25	10.230.104.160	0.246	1.000	4.047
10.36.193.37	10.230.104.160	0.246	1.000	4.047
10.31.97.54	10.230.104.160	0.246	1.000	4.047
10.31.25.64	10.230.104.160	0.246	1.000	4.047
10.31.29.65	10.230.104.160	0.246	1.000	4.047
10.36.193.76	10.230.104.160	0.246	1.000	4.047
10.36.193.105	10.230.104.160	0.246	1.000	4.047
10.31.38.109	10.230.104.160	0.246	1.000	4.047
10.36.193.112	10.230.104.160	0.246	1.000	4.047
10.36.193.116	10.230.104.160	0.246	1.000	4.047
10.31.39.128	10.230.104.160	0.246	1.000	4.047
10.31.8.147	10.230.104.160	0.246	1.000	4.047
10.31.28.153	10.230.104.160	0.246	1.000	4.047
10.31.127.160	10.230.104.160	1.000	1.000	1.000
10.31.14.162	10.230.104.160	0.246	1.000	4.047
10.31.25.169	10.230.104.160	0.246	1.000	4.047
10.36.193.192	10.230.104.160	0.246	1.000	4.047
10.31.40.196	10.230.104.160	0.246	1.000	4.047
10.31.124.199	10.230.104.160	0.246	0.956	4.229
10.31.42.208	10.230.104.160	0.246	1.000	4.047
10.31.29.210	10.230.104.160	0.246	1.000	4.047
10.230.226.211	10.230.104.160	0.246	1.000	4.047
10.31.108.220	10.230.104.160	0.246	1.000	4.047
10.31.0.224	10.230.104.160	0.246	1.000	4.047
10.31.43.224	10.230.104.160	0.246	0.396	10.219
10.31.3.226	10.230.104.160	0.246	1.000	4.047
10.31.3.229	10.230.104.160	0.246	1.000	4.047
10.30.96.43	10.31.127.160	0.195	1.000	5.100
10.31.126.128	10.31.127.160	1.000	1.000	1.000
10.230.104.160	10.31.127.160	1.000	1.000	1.000
10.31.147.224	10.31.127.160	0.195	1.000	5.100
10.31.48.1	10.31.130.160	1.000	1.000	1.000
10.230.3.10	10.31.130.160	1.000	1.000	1.000
10.31.213.64	10.31.130.160	1.000	1.000	1.000
10.31.153.96	10.31.130.160	0.195	1.000	5.100
10.31.152.176	10.31.130.160	0.195	1.000	5.100
10.31.131.192	10.31.130.160	1.000	1.000	1.000
10.31.147.224	10.31.130.160	0.195	1.000	5.100
10.31.151.65	10.31.157.160	1.000	1.000	1.000
10.31.159.128	10.31.157.160	1.000	0.858	1.164
10.31.226.209	10.31.157.160	0.929	0.929	1.157
10.31.213.64	10.230.18.161	1.000	1.000	1.000
10.230.23.141	10.230.18.161	1.000	1.000	1.000
10.230.104.160	10.31.14.162	1.000	0.246	INFINITE
10.230.104.160	10.31.25.169	1.000	0.234	4.250
10.31.97.54	10.31.35.169	1.000	1.000	INFINITE
10.31.115.32	10.31.38.170	1.000	1.000	INFINITE
10.31.11.33	10.31.38.170	0.784	1.000	INFINITE
10.31.43.224	10.31.48.172	0.341	0.360	8.124
10.31.22.107	10.31.25.176	0.937	0.890	1.198
10.31.37.8	10.31.40.176	1.000	0.427	2.339
10.230.226.211	10.31.40.176	1.000	1.000	1.000
10.230.226.212	10.31.40.176	1.000	1.000	1.000
10.230.226.215	10.31.40.176	1.000	1.000	1.000
10.31.115.32	10.31.79.176	1.000	1.000	1.000
10.31.212.33	10.31.79.176	1.000	1.000	1.000
10.31.83.60	10.31.79.176	1.000	1.000	1.000
10.31.109.64	10.31.79.176	1.000	1.000	1.000
10.31.79.67	10.31.79.176	1.000	1.000	1.000
10.31.97.67	10.31.79.176	1.000	1.000	1.000
10.31.157.97	10.31.79.176	1.000	1.000	1.000
10.230.210.104	10.31.79.176	1.000	1.000	1.000
10.230.38.209	10.31.79.176	1.000	1.000	1.000
10.31.96.216	10.31.79.176	1.000	1.000	1.000
10.31.130.160	10.31.152.176	1.000	0.195	5.100
10.31.23.24	10.31.98.188	1.000	1.000	INFINITE
10.31.11.33	10.31.98.188	1.000	1.000	INFINITE
10.36.137.1	10.31.131.192	1.000	1.000	1.000
10.230.210.97	10.31.131.192	1.000	1.000	1.000
10.31.126.128	10.31.131.192	1.000	1.000	1.000
10.31.130.160	10.31.131.192	1.000	1.000	1.000
10.31.130.208	10.31.131.192	1.000	1.000	1.000
10.230.104.160	10.36.193.192	1.000	0.246	4.047
10.31.48.1	10.36.243.192	0.894	1.000	1.118
10.230.23.141	10.36.243.192	1.000	1.000	1.000
10.36.243.193	10.36.243.192	1.000	1.000	1.000
10.36.243.195	10.36.243.192	1.000	1.000	1.000
10.36.243.199	10.36.243.192	1.000	1.000	1.000
10.36.243.192	10.36.243.193	1.000	1.000	1.000
10.36.243.195	10.36.243.193	1.000	1.000	1.000
10.36.243.199	10.36.243.193	1.000	1.000	1.000
10.36.243.192	10.36.243.195	1.000	1.000	1.000
10.36.243.193	10.36.243.195	1.000	1.000	1.000
10.36.243.199	10.36.243.195	1.000	1.000	1.000
10.230.104.160	10.31.40.196	1.000	0.246	4.047
10.230.242.133	10.230.11.198	1.000	1.000	INFINITE
10.230.23.141	10.230.11.198	1.000	1.000	INFINITE
10.31.51.150	10.230.11.198	1.000	1.000	INFINITE
10.31.54.217	10.230.11.198	1.000	1.000	INFINITE
10.31.54.222	10.230.11.198	1.000	1.000	INFINITE
10.230.104.160	10.31.124.199	0.956	0.246	4.229
10.36.243.192	10.36.243.199	1.000	1.000	1.000
10.36.243.193	10.36.243.199	1.000	1.000	1.000
10.36.243.195	10.36.243.199	1.000	1.000	1.000
10.31.19.208	10.31.44.200	0.172	0.403	INFINITE
10.31.18.254	10.31.44.200	1.000	1.000	INFINITE
10.36.102.129	10.31.13.208	1.000	1.000	INFINITE
10.31.44.200	10.31.19.208	0.403	0.148	INFINITE
10.230.104.160	10.31.42.208	1.000	0.246	INFINITE
10.31.107.12	10.31.75.208	0.874	1.000	1.143
10.31.45.111	10.31.75.208	1.000	1.000	1.000
10.31.131.192	10.31.130.208	1.000	1.000	INFINITE
10.31.115.32	10.31.167.208	1.000	1.000	INFINITE
10.31.11.33	10.31.167.208	0.972	0.901	INFINITE
10.31.79.176	10.230.38.209	1.000	1.000	1.000
10.31.85.49	10.31.226.209	0.251	0.133	29.883
10.31.151.65	10.31.226.209	0.364	0.313	8.739
10.31.157.160	10.31.226.209	0.929	0.917	1.172
10.230.104.160	10.31.29.210	1.000	0.246	4.047
10.230.104.160	10.230.226.211	1.000	0.246	4.047
10.31.40.176	10.230.226.211	1.000	1.000	1.000
10.230.226.212	10.230.226.211	1.000	1.000	1.000
10.230.226.215	10.230.226.211	1.000	1.000	1.000
10.31.13.104	10.31.35.212	0.991	0.776	INFINITE
10.31.40.176	10.230.226.212	1.000	1.000	1.000
10.230.226.211	10.230.226.212	1.000	1.000	1.000
10.230.226.215	10.230.226.212	1.000	1.000	1.000
10.230.23.141	10.31.34.213	1.000	1.000	1.000
10.31.40.176	10.230.226.215	1.000	1.000	1.000
10.230.226.211	10.230.226.215	1.000	1.000	1.000
10.230.226.212	10.230.226.215	1.000	1.000	1.000
10.31.79.176	10.31.96.216	1.000	1.000	1.000
10.31.51.150	10.31.54.217	1.000	1.000	INFINITE
10.230.11.198	10.31.54.217	1.000	1.000	INFINITE
10.31.54.222	10.31.54.217	1.000	1.000	INFINITE
10.31.111.100	10.31.104.220	0.921	1.000	1.085
10.31.96.102	10.31.104.220	0.843	1.000	1.186
10.230.104.160	10.31.108.220	1.000	0.246	INFINITE
10.31.51.150	10.31.54.222	1.000	1.000	INFINITE
10.230.11.198	10.31.54.222	1.000	1.000	INFINITE
10.31.54.217	10.31.54.222	1.000	1.000	INFINITE
10.230.104.160	10.31.0.224	1.000	0.246	INFINITE
10.230.104.160	10.31.43.224	0.396	0.246	10.219
10.31.48.172	10.31.43.224	0.360	0.368	7.519
10.31.127.160	10.31.147.224	1.000	0.195	INFINITE
10.31.130.160	10.31.147.224	1.000	0.195	INFINITE
10.230.104.160	10.31.3.226	1.000	0.246	4.047
10.230.104.160	10.31.3.229	1.000	0.246	4.047
10.31.21.40	10.31.40.233	1.000	0.925	INFINITE
10.31.34.45	10.31.92.240	0.796	0.442	2.834
10.31.126.128	10.31.92.240	1.000	1.000	1.000
10.230.3.10	10.31.160.241	1.000	1.000	1.000
10.31.199.254	10.31.199.253	0.991	0.886	INFINITE
10.31.44.200	10.31.18.254	1.000	1.000	1.000
10.31.77.254	10.31.18.254	0.917	1.000	1.089
10.31.107.15	10.31.77.254	1.000	1.000	INFINITE
10.31.42.112	10.31.77.254	0.940	1.000	INFINITE
10.31.1.128	10.31.77.254	1.000	1.000	INFINITE
10.31.18.254	10.31.77.254	1.000	0.917	INFINITE
10.30.96.54	10.30.96.254	1.000	1.000	INFINITE
10.31.199.253	10.31.199.254	0.886	0.983	1.146

Table: Gateways
Status Gateway IP                                    ETX             Hopcnt Uplink    Downlnk   IPv4    IPv6 Prefix

Table: Interfaces
Name	State	MTU	WLAN	Src-Adress	Mask	Dst-Adress
switch0.10	UP	1472	No	10.31.174.8	255.255.255.255	255.255.255.255
switch0.11	UP	1472	No	10.31.174.9	255.255.255.255	255.255.255.255
switch0.20	UP	1472	No	10.31.174.10	255.255.255.255	255.255.255.255

Table: Neighbors
IP address	SYM	MPR	MPRS	Will.	(2-hop address)+
10.31.83.60	YES	YES	NO	3	10.31.79.177

Table: Smart Gateway IPv4
 Originator      Prefix                          Uplink    Downlink  PathCost   IPv4 IPv4-NAT IPv6 Tunnel-Name     Destination     Cost

Version: olsr.org - pre-0.9.9-git_0000000-hash_912fe6e079f7b7b9fd547d8a856e846c

```

**Comment by FFHener** [comment]
As the problem accured again the other side magda reported the following in dmesg:

```
[8053815.566598] neighbour: ndisc_cache: neighbor table overflow!
[8053815.566737] neighbour: ndisc_cache: neighbor table overflow!
[8053816.607283] neighbour: ndisc_cache: neighbor table overflow!
[8053816.607458] neighbour: ndisc_cache: neighbor table overflow!
[8053816.928190] neighbour: ndisc_cache: neighbor table overflow!
[8053817.326025] neighbour: ndisc_cache: neighbor table overflow!
```

**Comment by pktpls** [comment]
A symptom we saw together with `ndisc_cache: neighbor table overflow` is OLSR link quality oscillating between crap and good repeatedly within a minute.

**Comment by FFHener** [comment]
In the end the corerouter didnt received enough energy which caused a lot of weird behaviours. As this is solved im closing this issue for now
